Judul,Isi,Tanggal,Kategori
Airlangga soal Ekonomi Kuartal III Tumbuh di Bawah 5 Persen: Musiman,"Menteri Koordinator Bidang Perekonomian Airlangga Hartarto mengatakan pertumbuhan ekonomi pada kuartal III-2024 yang tak sampai 5 persen disebabkan oleh faktor musiman.
Berdasarkan data Badan Pusat Statistik (BPS), perekonomian Indonesia tumbuh 4,95 persen secara year on year (yoy) pada kuartal III tahun ini. Angka ini lebih tinggi dari kuartal III-2023 yang sebesar 4,94 persen, tetapi lebih rendah dibandingkan kuartal II-2024 sebesar 5,05 persen.
""Dalam siklus pertumbuhan ekonomi ini, kuartal ketiga tidak terdapat hari besar atau event besar seperti liburan keagamaan atau liburan sekolah, sehingga memang kuartal ketiga cenderung seperti itu,"" ujar Airlangga dalam konferensi pers di kantornya, Selasa (5/11).
ADVERTISEMENT
SCROLL TO CONTINUE WITH CONTENT
Meski demikian, ia optimis pertumbuhan ekonomi sepanjang tahun ini bakal tetap berada di atas 5 persen. Dalam APBN 2024 pemerintah menargetkan perekonomian bisa tumbuh 5,2 persen. Optimisme ini muncul sebab secara kumulatif periode Januari-September 2024, perekonomian masih berhasil tumbuh 5,03 persen.

""Artinya, dengan pertumbuhan 5,03 persen, kita masih bisa berharap perekonomian kita bisa menjaga levelnya di angka 5 persen pada akhir tahun, sesuai dengan target APBN,"" jelasnya.
Untuk menggenjot perekonomian lebih tinggi lagi, terutama pada kuartal IV, maka pemerintah berupaya memperbaiki daya beli masyarakat yang turun. Hal ini tercermin dari konsumsi rumah tangga hanya tumbuh 4,91 persen, lebih rendah dari kuartal II sebesar 4,93 persen.
Kebijakan yang bakal ditempuh pemerintah, kata Airlangga, adalah memperpanjang insentif perpajakan hingga akhir tahun, di antaranya PPN DTP untuk properti, PPnBM DTP untuk mobil listrik hingga FLPP (Fasilitas Likuiditas Pembiayaan Perumahan).

""Pemerintah juga sedang mempersiapkan pemanfaatan dana dari jaminan kecelakaan kerja dan mendorong kewirausahaan melalui KUR,"" jelasnya.
Selain itu, pemerintah juga bakal mencegah terjadinya Pemberhentian Hubungan Kerja (PHK) besar-besaran, terutama di sektor usaha tekstil.
""Nah tentu kita dorong beberapa kebijakan, salah satu adalah mencegah terjadinya PHK. Pemerintah akan memperhatikan kebijakan yang akan diambil. Terutama pada saat 1-2 bulan ke depan sedang mempersiapkan insentif yang bisa didorong di sektor padat karya,"" pungkasnya.
[Gambas:Video CNN]","Selasa, 05 Nov 2024 21:03 WIB",Kategori tidak ditemukan
"Tak Lagi BUMN, Bulog Bakal Jadi Badan Otonom di Bawah Presiden","Direktur Utama Perum Bulog Wahyu Suparyono mengatakan Bulog akan diubah menjadi badan otonom yang berada langsung di bawah presiden. Dengan begitu, Bulog tidak akan lagi berstatus sebagai Badan Usaha Milik Negara (BUMN).
""Nanti Bulog jadi lembaga pemerintahan lainnya, di bawah presiden. Enggak (berstatus BUMN lagi) dong,"" katanya di Kompleks MPR/DPR, Senayan, Jakarta, Selasa (5/11).
Menurutnya, Bulog akan sama seperti Badan Gizi Nasional yang berada langsung di bawah presiden. Ia pun membantah kabar bahwa Bulog akan berada di bawah Kementerian Pertanian (Kementan).
ADVERTISEMENT
SCROLL TO CONTINUE WITH CONTENT
""Kurang lebih (seperti Badan Gizi). Saya tidak ada perintah (di bawah Kementan). Saya diminta Pak Presiden menyiapkan transformasi kelembagaan,"" katanya.

Menurutnya, transformasi Bulog nantinya akan diatur dalam Keputusan Presiden (Keppres).
Wahyu bercerita ia memang diminta khusus oleh Prabowo untuk memimpin BUMN pangan tersebut, menggantikan posisi Bayu Krisnamurthi. Pada 28 Agustus lalu, ia ditelepon Prabowo yang saat itu masih menjadi presiden terpilih.
""Pak Prabowo secara khusus telepon saya 28 Agustus, Mas Wahyu masuk Bulog, benerin semua. (Saya bilang) 'siap presiden terpilih',"" kata Wahyu.
Ia mengatakan Prabowo memberikannya tugas untuk menyukseskan swasembada pangan. Apalagi Wahyu pernah menjabat sebagai direktur operasional Bulog.

""Saya diminta Pak Presiden Prabowo kalau konkretnya persiapan transisi secara khusus saya diperintahkan 'Mas Wahyu, transformasi kelembagaan Bulog. Mas Wahyu pernah direktur operasional, tugas khusus swasembada pangan',"" imbuhnya.
Wahyu memang bukanlah orang baru di lingkungan BUMN. Ia pernah menempati posisi Direktur Utama Asabri pada 2020. Pada 2017-2020, ia pernah menjabat sebagai Direktur Utama PT Dok dan Perkapalan Kodja Bahari (Persero). Jabatan terakhir sebelum diangkat menjadi direktur utama Asabri.
Lalu, pada 2016-2017, ia juga pernah menjabat sebagai Direktur SDM dan Umum Perum Bulog. Di mana, sebelumnya, pada 2015-2018 ia ditetapkan sebagai Komisaris Utama PT Jasa Prima Logistik (JPL) Bulog.
Pria kelahiran 17 Oktober di Magelang ini juga pernah menjadi Direktur Operasional dan Pelayanan Publik Perum Bulog pada 2015-2016, dan tercatat juga sebagai Direktur Utama PT Perusahaan Perdagangan Indonesia pada 2014-2015.
[Gambas:Video CNN]","Selasa, 05 Nov 2024 20:46 WIB",Kategori tidak ditemukan
"Kebijakan Hapus Utang Tak Berlaku Buat Semua UMKM, Apa Kriterianya?","Menteri Usaha Mikro, Kecil, dan Menengah (UMKM) Maman Abdurrahman menekankan kebijakan hapus utang macet di masa lalu tidak diberikan ke seluruh pelaku UMKM, termasuk petani dan nelayan di Indonesia.
""Tidak semua pelaku UMKM kita hapuskan utang piutangnya, ini (buat) memang betul-betul tidak bisa tertolong kembali,"" kata Maman di Istana Kepresidenan Jakarta, Selasa (5/11).
Maman menegaskan kebijakan itu hanya menyasar para pelaku UMKM, nelayan, petani yang terdata sementara di mana jumlahnya kurang lebih 1 juta orang.
ADVERTISEMENT
SCROLL TO CONTINUE WITH CONTENT
Satu jutaan orang itu merupakan pelaku UMKM di bidang perikanan dan pertanian yang terpuruk akibat dampak dari pandemi covid-19) hingga bencana alam.

Maman pun merinci kebijakan ini hanya untuk para pelaku UMKM, nelayan, dan petani yang berutang Rp500 juta bagi badan usaha, serta Rp300 juta untuk utang perseorangan.
Ia menyebut hapus buku dan hapus tagih utang lama UMKM adalah bagian dari stimulus pemerintah. Kebijakan ini dilakukan demi memastikan kegiatan ekonomi bisa berputar kembali.
""Jadi ini yang memang yang betul-betul sudah tidak memiliki kemampuan lagi, dan itu rentangnya sekitar 10 tahunan,"" ujarnya.

Presiden Prabowo Subianto resmi menghapus utang masa lalu UMKM, termasuk petani dan nelayan. Kebijakan itu tertuang dalam PP Nomor 47 Tahun 2024 yang diteken pada hari ini, Selasa (5/11).
Prabowo menyebut keputusan itu ia ambil usai mendengar banyak aspirasi dari kelompok tani hingga UMKM. Ia berharap kebijakan itu dapat membantu rakyat khususnya produsen yang bekerja di bidang pertanian UMKM dan nelayan yang merupakan produsen pangan.
Adapun perihal hal-hal teknis seperti persyaratan untuk penghapusan kredit atau utang macet akan didetailkan melalui aturan di kementerian/lembaga terkait.
[Gambas:Video CNN]
","Selasa, 05 Nov 2024 20:22 WIB",Kategori tidak ditemukan
"1,3 Juta Ha Lahan Terlantar Bisa Buat Bangun 3 Juta Rumah Prabowo","Menteri ATR/ Kepala BPN Nusron Wahid mengungkapkan negara punya 1,3 juta hektare (ha) tanah terlantar yang bisa digunakan untuk membangun 3 juta rumah.
""Kalau kami (ATR/BPN) itu punya tanah terlantar, potensi terlantar selama 5 tahun ke depan ini 1,3 juta hektare. Banyak kan? Kalau dibuat kuburan muat berapa orang itu,"" ungkapnya di Kementerian ATR/BPN, Jakarta Selatan, Selasa (5/11).
""Cuma kita belum tahu apakah 1,3 juta hektare ini ada berapa yang cocok untuk perumahan. Kan enggak mungkin bekas kebun kelapa sawit dipakai untuk rumah. Tanah itu kita pasti carikan lokasi yang bagus, yang bisa layak untuk tempat tinggal,"" imbuh Nusron.
ADVERTISEMENT
SCROLL TO CONTINUE WITH CONTENT
Ia paham bahwa Presiden Prabowo Subianto memiliki program membangun 3 juta rumah per tahun. Rinciannya, 2 juta rumah di desa dan 1 juta apartemen di perkotaan.

Program tersebut ditugaskan kepada Menteri Perumahan dan Kawasan Permukiman Maruarar Sirait. Nusron menyebut Menteri Ara telah menanyakan kepada ATR/BPN soal potensi tanah terlantar tersebut untuk didirikan rumah.
""Bagaimana legalisasinya? Kalau itu sepanjang sudah masuk kategori tanah terlantar, itu masuk tanah negara. Tinggal nanti negara memberikan hak pengelolaan (HPL). Kepada siapa, kita bisa serahkan kepada land bank (Badan Bank Tanah),"" jelasnya.
""Nanti pembangunan rumahnya menggunakan hak di atas hak, yaitu hak guna bangunan (HGB) di atas HPL. (Masyarakat pembeli rumah dapat HGB bukan SHM?) ya namanya tanah, nanti dapatnya HGB,"" tegas Nusron.

Nusron menegaskan tanah terlantar itu tidak termasuk lahan sitaan koruptor. Ia menyebut lahan di ATR/BPN adalah eks HGB dan hak guna usaha (HGU) yang sudah selesai penggunaannya.
""Ketika (HGU/HGB) gak diperpanjang itu masuk kategori tanah terlantar. Kemudian, diserahkan kepada orang lain atau pihak yang membutuhkan,"" tutupnya.
[Gambas:Video CNN]
","Selasa, 05 Nov 2024 19:59 WIB",Kategori tidak ditemukan
"2,9 Juta Ton Beras Impor Banjiri RI per Oktober 2024","Perum Bulog mencatat 2,9 juta ton beras impor telah masuk ke Indonesia per Oktober 2024. Beras impor berasal dari Kamboja, Myanmar, Pakistan, Thailand, dan Vietnam.
""Beras impor kami ambil dari berbagai negara dan melalui proses tender,"" kata Direktur Utama Bulog Wahyu Suparyono dalam rapat kerja dengan Komisi IV DPR, Selasa (5/11).
Wahyu merinci beras impor dari Kamboja sebanyak 22.500 ton, Myanmar 451.468 ton, Pakistan 388.675 ton, Thailand 1,04 juta ton, dan Vietnam 1,02 juta ton.
ADVERTISEMENT
SCROLL TO CONTINUE WITH CONTENT
Ia menjelaskan beras impor 2,9 juta ton beras impor itu merupakan gabungan dari 3,6 juta ton penugasan tahun ini dan carry over tahun lalu.

Sementara sisanya, sambung Wahyu, akan ada sekitar 1 juta ton beras impor yang akan masuk hingga akhir tahun ini. Hal itu senada dengan pernyataan Menteri Koordinator Pangan Zulkifli Hasan (Zulhas).
""Impor termasuk carry over tahun lalu. (1 juta bakal masuk) termasuk carry over. Sekarang sedang proses, harus masuk di Desember pertengahan,"" imbuhnya.
Sebelumnya, Zulhas mengatakan akan ada 1 juta ton beras impor yang akan masuk. Rinciannya 150 ribu ton akan tiba di Indonesia dalam waktu dekat, sedangkan 850 ribu ton akan coba dikejar sampai akhir tahun ini.
Beras impor akan digunakan untuk Cadangan Beras Pemerintah (CBP) yang ditargetkan sebanyak 2 juta ton akhir tahun ini.
""Ya memang sekarang sekurang-kurangnya 2 juta ton (di akhir tahun 2024), yang belum itu 850 ribu ton. Ya tentu ini akan dikejar, kalau bisa tahun ini selesai, 850 ribu ton itu bisa masuk semua,"" kata Zulhas saat melakukan peninjauan di gudang beras Bulog Sunter Timur, Jakarta Utara, dikutip CNBC, Senin (4/11).
[Gambas:Video CNN]","Selasa, 05 Nov 2024 19:28 WIB",Kategori tidak ditemukan
Waspada Tawaran Pelunasan Utang Pinjol Agar Tak Makin Terpuruk,"Satuan Tugas Pemberantasan Aktivitas Keuangan Ilegal (Satgas PASTI) mengingatkan masyarakat untuk waspada terhadap tawaran pelunasan utang pinjaman online (pinjol) yang justru merugikan para korban.
""Pihak tersebut menawarkan kepada para korban untuk melunasi utang pada pinjaman online sebelumnya dengan cara membantu mengajukan utang baru di pinjaman online lainnya,"" ujar Sekretariat Satgas PASTI Hudiyanto dalam keterangan resmi, Selasa (5/11).
Tawaran itu mengklaim akan mengurus dan menyelesaikan seluruh utang pinjol korban. Namun, setelah korban menyerahkan sejumlah dana sebagai imbal jasa, penyelesaian utang yang dijanjikan ternyata tidak terpenuhi, sehingga korban terjebak dalam lingkaran utang yang semakin besar.
ADVERTISEMENT
SCROLL TO CONTINUE WITH CONTENT
""Pada kenyataannya, pihak tersebut tidak memenuhi tawaran yang telah dijanjikan, sehingga utang korban tidak terselesaikan dan justru semakin bertambah banyak dengan adanya utang baru,"" ujarnya.

Karenanya, Satgas PASTI mengimbau masyarakat agar tidak tergiur dengan tawaran pelunasan utang ini, yang hanya akan memperparah kondisi keuangan para korban.
Masyarakat disarankan untuk menghubungi pihak berwenang atau lembaga keuangan resmi yang berlisensi jika membutuhkan bantuan terkait pengelolaan utang, daripada mempercayai pihak-pihak tak resmi yang berpotensi menipu.
Sejak berdiri pada 2017, hingga 30 September 2024, Satgas telah menghentikan 11.398 entitas keuangan ilegal. Dari jumlah tersebut, 1.528 merupakan entitas investasi ilegal, 9.610 terkait pinjaman online ilegal atau pinpri, dan 251 entitas gadai ilegal.

Untuk itu, Satgas PASTI mengimbau masyarakat agar selalu berhati-hati dan tidak menggunakan layanan pinjol atau pinpri ilegal, mengingat risiko besar, termasuk penyalahgunaan data pribadi.
Masyarakat juga diminta untuk lebih waspada terhadap penawaran investasi yang beredar di media sosial, terutama Telegram, yang kerap digunakan sebagai saluran oleh pelaku penipuan dengan modus impersonation.
[Gambas:Video CNN]

","Selasa, 05 Nov 2024 19:03 WIB",Kategori tidak ditemukan
PNM Peduli Wujudkan Cinta Puspa dan Satwa,"Permodalan Nasional Madani (PNM) melalui PNM Peduli sebagai bagian Tanggung Jawab Sosial dan Lingkungan (TJSL) terus berupaya melestarikan puspa dan satwa nasional. Hingga Oktober 2024, PNM melakukan penanaman 286.461 pohon dari berbagai jenis, termasuk terumbu karang.
Keberhasilan berbagai program PNM Peduli dalam aspek keanekaragaman hayati tak terlepas dari berkat kolaborasi dengan berbagai pihak untuk mendukung komitmen yang sejalan dengan fokus PNM, yaitu membantu mencapai 17 indikator Sustainable Development Goals (SDGs) dan bagian dari implementasi ESG Perusahaan.
Untuk itu, Direktur Utama PNM Arief Mulyadi mengajak seluruh masyarakat untuk merayakan Hari Cinta Puspa dan Satwa Nasional yang jatuh setiap 5 November, antara lain melalui aktifitas pengelolaan sumber daya alam dan lingkungan yang berkelanjutan.
ADVERTISEMENT
SCROLL TO CONTINUE WITH CONTENT
""Ikhtiar kami untuk membantu menyukseskan komitmen pemerintah dalam pengurangan emisi karbon. Tapi lebih dari itu, beberapa jenis tanaman kami tanam memberi dampak bagi ekonomi keluarga prasejahtera,"" kata Arief.
Adapun tanaman pangan yang telah ditanam PNM itu termasuk yang bisa langsung dimanfaatkan hasilnya, seperti bibit buah-buahan dan cabai. Selain itu, masih ada beberapa pohon lain dapat menjadi sumber penghasilan tambahan masyarakat sekitar.
""Hasil panen dari pohon buah dan sayur ataupun pohon kayu-kayuan dapat dikonsumsi oleh warga. Jika hasil panen melimpah ruah bisa dijual, jadi pemasukan tambahan juga. Produk jualan nasabah PNM Mekaar yang ada di lokasi penanaman jadi bisa lebih variatif,"" papar Arief.
Sebagai lembaga negara yang bertugas memberikan pembiayaan dan pendampingan berkelanjutan terhadap perempuan prasejahtera pelaku UMKM agar lebih berdaya. Pembiayaan dan pendampingan secara berkesinambungan ini yang menjadi pembeda PNM dengan lembaga pembiayaan lain.
","Selasa, 05 Nov 2024 18:58 WIB",Kategori tidak ditemukan
"Justin Hubner Kembali, Siapa Jadi Korban di Timnas Indonesia?","Justin Hubner dipanggil kembali oleh Shin Tae Yong ke Timnas Indonesia setelah absen dalam dua laga sebelumnya karena cedera.
Pada Jumat (15/11), Indonesia akan menjamu Jepang dalam lanjutan Kualifikasi Piala Dunia 2026. Apakah Hubner akan langsung jadi pilihan di lini pertahanan Timnas Indonesia?
Sepertinya tidak. Komposisi Jay Idzes, Mess Hilgers, dan Rizky Ridho sudah solid. Meski ketiganya masih mencoba menjalin chemistry, komposisi ini paling menjanjikan.
ADVERTISEMENT
SCROLL TO CONTINUE WITH CONTENT

Melawan Jepang yang berkekuatan individu tangguh duel satu lawan satu, bek dengan kemampuan bertahan lugas dan cerdas membaca pergerakan lawan jadi kebutuhan penting.
Karena itu pula komposisi Ridho, Hilgers, dan Idzes, sangat mungkin jadi pilihan utama. Dalam situasi ini Jordi Amat yang pergerakannya kurang cepat, lebih baik menjadi opsi kedua.
Namun, jika Hilgers tidak dalam kondisi prima, karena dalam proses pemulihan cedera, Jordi bisa menjadi opsi. Postur dan kecerdasan bermain Jordi tetap salah satu yang terunggul.

Begitu pula dengan Muhammad Ferarri, bisa jadi opsi pengganti. Adapun Hubner, yang juga seorang bek tengah, untuk laga melawan Jepang bisa menjadi pilihan di posisi gelandang.
Absennya Ivar Jenner membuat lini tengah kekurangan pemain. Ivar Jenner bakal absen di Indonesia vs Jepang karena akumulasi kartu kuning.
Jika Shin Tae Yong ingin bertahan total saat melawan Jepang, memakai dua gelandang bertahan pilihan realistis.
Memadukan Hubner bersama Nathan Tjoe-A-On bisa jadi pilihan yang menarik. Apalagi keduanya sudah beberapa kali dimainkan bersama di posisi ini, yakni saat di Piala Asia U-23 2023.
Rencananya pemain Timnas Indonesia mulai berkumpul di Jakarta pada Minggu (10/11). Persiapan empat hari akan dimaksimalkan sebelum bentrok dengan Jepang di Senayan.

[Gambas:Video CNN]
","Selasa, 05 Nov 2024 21:47 WIB",Kategori tidak ditemukan
Exco PSSI: Liga 2 Pakai VAR dalam 1-2 Tahun ke Depan,"Anggota Komite Eksekutif (Exco) PSSI Arya Sinulingga menyebut terdapat rencana Liga 2 menggunakan Video Assistant Referee (VAR) dalam satu atau dua tahun ke depan.
Hal tersebut disampaikan Arya saat menanggapi hasil survei Indikator Politik Indonesia terhadap sikap publik terkait pemain naturalisasi. Arya menyampaikan, naturalisasi pemain bukan satu-satunya fokus PSSI untuk mengembangkan sepak bola Indonesia.
""Ini evaluasi juga untuk kami karena naturalisasi membuahkan pemain yang baik. Survei ini mewakili masyarakat Indonesia dan sangat baik bagi kami. Tapi naturalisasi bukan satu-satunya hal yang dikerjakan PSSI. Bersamaan dengan itu PSSI juga berupaya untuk memperbaiki kompetisi seperti Liga 1, Liga 2 dan sebagainya,"" kata Arya, Selasa (5/11).
ADVERTISEMENT
SCROLL TO CONTINUE WITH CONTENT

""Dalam 1-2 tahun mendatang, kami berencana pakai VAR untuk Liga 2. Ini karena VAR membantu Liga 1 lebih baik. Kita salah satu negara di Asia yang lebih dulu pakai VAR,"" ucap Arya menambahkan.
VAR sudah diterapkan Liga 1 mulai musim 2024/2025. Rencananya, teknologi penunjang wasit itu akan dipakai di kasta tertinggi sepak bola Indonesia hingga 2028 mendatang.
Lebih lanjut, Arya mengatakan tingkat kepuasan masyarakat yang tinggi terhadap kepemimpinan Erick Thohir dalam memimpin PSSI berhulu dari kerja keras selama menakhodai federasi sepak bola Indonesia.

""Terkait kepuasan ini, adalah dampak yang sudah diberikan PSSI selama dua tahun terakhir. Pembinaan usia muda terus dilakukan. Seluruh kelompok umur masuk ke Piala Asia dan kita masuk sembilan negara Asia yang mencapai itu,"" ujar Arya.
""Kami terkejut, karena survei ini mewakili masyarakat Indonesia. Tidak hanya mewakili orang yang suka bola. Jadi ini suka dan tidak suka, tahu dan tidak tahu masuk survei juga,""kata Arya melanjutkan.
Survei dilakukan dalam periode 10-15 Oktober 2024, menempatkan 1.200 responden yang diwawancarai secara tatap muka. Dari temuan lembaga survei Indikator Politik Indonesia, sebanyak 94,5 persen masyarakat menyatakan puas dengan kinerja Erick Thohir sebagai Ketum PSSI.

[Gambas:Video CNN]

","Selasa, 05 Nov 2024 21:15 WIB",Kategori tidak ditemukan
Klasemen Piala AFF Futsal Usai Thailand Gilas Malaysia,"Klasemen Piala AFF Futsal 2024 mengalami perubahan usai Thailand berhasil mengalahkan Malaysia, Selasa (5/11). Berikut klasemen Piala AFF Futsal 2024, Selasa (5/11) malam WIB.
Tim tuan rumah Piala AFF Futsal 2024 Thailand sukses mengalahkan Malaysia 3-1 di Terminal Hall, Nakhon Ratchasima, Selasa (5/11) malam WIB.
Kemenangan ini membuat Thailand berhasil kembali naik ke posisi puncak klasemen Grup A dengan mengemas sembilan poin dari tiga pertandingan yang telah dilakoni. Hasil ini juga memastikan Thailand lolos ke semifinal Piala AFF Futsal 2024.
ADVERTISEMENT
SCROLL TO CONTINUE WITH CONTENT
Sebaliknya kekalahan ini membuat Malaysia tertahan di posisi ketiga klasemen Piala AFF Futsal 2024 dengan mengemas tiga poin dari tiga pertandingan yang dilakoni.
Kekalahan ini juga membuat Malaysia dipastikan gagal lolos ke semifinal Piala AFF Futsal 2024 karena sudah tidak memungkinkan untuk menyalip perolehan sembilan angka Thailand dan Vietnam.
Vietnam kini menempati posisi kedua klasemen Grup A dengan mengemas sembilan poin dari tiga pertandingan yang dijalani.



Pada laga Rabu (6/11), Thailand akan menghadapi Vietnam di pertandingan terakhir Grup A. Pemenang laga ini akan finis sebagai juara Grup A.
Sementara pada pertandingan lainnya di Grup B, Timnas Futsal Indonesia memastikan lolos ke semifinal usai mengalahkan Australia 3-1 pada laga lanjutan Grup B, Selasa (5/11) siang WIB.
Kemenangan ini memperkokoh posisi Indonesia di puncak klasemen Grup B dengan mengemas enam poin dari dua pertandingan yang dijalani. Indonesia sudah memastikan lolos ke semifinal Piala AFF Futsal 2024.
Sebaliknya, kekalahan ini membuat Australia turun ke posisi ketiga klasemen Grup B dengan mengemas satu poin dari dua pertandingan yang dilakoni.
Australia wajib memenangkan pertandingan terakhir di Grup B melawan Kamboja untuk menjaga peluang lolos ke semifinal.
Grup A:1. Thailand 9 Poin2. Vietnam 93. Malaysia 34. Timor Leste 35. Brunei 0
Grup B:1. Indonesia 6 Poin2. Myanmar 43. Australia 14. Kamboja 0
[Gambas:Video CNN]
","Selasa, 05 Nov 2024 20:45 WIB",Kategori tidak ditemukan
Akmal Sebut Naturalisasi Adalah Keniscayaan dalam Sepak Bola,"Pengamat sepak bola nasional Akmal Marhali menyebut naturalisasi merupakan keniscayaan atau hal yang pasti dalam sepak bola, termasuk untuk Timnas Indonesia.
Karena itu FIFA membolehkan setiap negara melakukan naturalisasi. Dalam pasal 19 statuta FIFA menjelaskan, syarat melakukan naturalisasi adalah pemain lahir di negara bersangkutan, ayah atau ibu kandungnya lahir di negara terkait, kakek atau neneknya lahir di negara terkait, pemain telah tinggal di negara terkait selama 5 tahun saat usianya mencapai 18 tahun.
""Jadi dari 4 syarat naturalisasi ini, jika ada salah satu syarat tersebut maka FIFA membolehkan proses naturalisasi,"" kata Akmal dalam pemaparan hasil survei lembaga Indikator Politik Indonesia terkait dengan kinerja PSSI, Selasa (5/11).
ADVERTISEMENT
SCROLL TO CONTINUE WITH CONTENT
Menurut Akmal, naturalisasi bukan barang baru dalam sepak bola. Tercatat sudah 108 pemain sepak bola mendapatkan naturalisasi sejak zaman Cristian Gonzalez hingga kini. Angka tersebut belum termasuk pemain yang ada di era 1950-an.
""Jadi pada saat kita bermain Piala Dunia 1938, itu adalah pertama kalinya ada naturalisasi, ada yang berdarah Indonesia asli, ada yang berdarah China, ada yang berdarah Belanda, ada yang keturunan Maluku Belanda,"" ucap Akmal.
Meski begitu, Akmal yang juga koordinator Save Our Soccer mengingatkan, naturalisasi bisa menjadi bom waktu, terutama saat prestasi atau performa Timnas Indonesia menurun.

""Kita ini sebenarnya mengikuti strategi Jepang, dahulu mereka juga melakukan naturalisasi tapi hanya untuk jangka pendek untuk mengangkat performa Tim nasional Jepang. Karena Jepang sebelumnya itu tim yang tidak ada apa-apanya,"" tutur Akmal.
Dalam hasil survei Indikator itu sebanyak 54,5 persen responden tidak mempermasalahkan jumlah pemain naturalisasi. Sementara 31,5 persen responden setuju dengan terlalu banyaknya pemain naturalisasi.
""Dengan lonjakan timnas dalam peringkat FIFA, mayoritas publik memberi apresiasi yang tinggi dengan peningkatan kualitas permainan timnas. [Sebanyak] 80,3 persen mayoritas bilang kualitas timnas saat ini bagus dan sangat bagus. Umumnya mereka merasa level timnas sudah jauh meningkat,"" kata Direktur Indikator, Burhanuddin Muhatadi.

[Gambas:Video CNN]
","Selasa, 05 Nov 2024 20:30 WIB",Kategori tidak ditemukan
